Title,Speaker,Conference
Where Your Treasure Is,Elder Michael John U. Teh,April 2014
If Ye Lack Wisdom,Elder Marcos A. Aidukaitis,April 2014
The Resurrection of Jesus Christ,Elder D. Todd Christofferson,April 2014
Until We Meet Again,President Thomas S. Monson,April 2014
"Keeping Covenants Protects Us, Prepares Us, and Empowers Us",Rosemary M. Wixom,April 2014
"Sisterhood: Oh, How We Need Each Other",Bonnie L. Oscarson,April 2014
Wanted: Hands and Hearts to Hasten the Work,Linda K. Burton,April 2014
Daughters in the Covenant,President Henry B. Eyring,April 2014
Welcome to Conference,President Thomas S. Monson,October 2014
The Reason for Our Hope,President Boyd K. Packer,October 2014
Which Way Do You Face?,Elder Lynn G. Robbins,October 2014
The Sacrament—a Renewal for the Soul,Cheryl A. Esplin,October 2014
Rescue in Unity,Elder Chi Hong (Sam) Wong,October 2014
"Free Forever, to Act for Themselves",Elder D. Todd Christofferson,October 2014
Receiving a Testimony of Light and Truth,President Dieter F. Uchtdorf,October 2014
The Sustaining of Church Officers,sented by President Henry B. Eyring,October 2014
Loving Others and Living with Differences,Elder Dallin H. Oaks,October 2014
Joseph Smith,Elder Neil L. Andersen,October 2014
Parents: The Prime Gospel Teachers of Their Children,Tad R. Callister,October 2014
Approaching the Throne of God with Confidence,Elder Jörg Klebingat,October 2014
"Yes, Lord, I Will Follow Thee",Elder Eduardo Gavarret,October 2014
Are We Not All Beggars?,Elder Jeffrey R. Holland,October 2014
Finding Lasting Peace and Building Eternal Families,Elder L. Tom Perry,October 2014
Choose Wisely,Elder Quentin L. Cook,October 2014
I Know These Things of Myself,Elder Craig C. Christensen,October 2014
The Law of the Fast: A Personal Responsibility to Care for the Poor and Needy,Bishop Dean M. Davies,October 2014
"“Lord, Is It I?”",President Dieter F. Uchtdorf,October 2014
The Preparatory Priesthood,President Henry B. Eyring,October 2014
Guided Safely Home,President Thomas S. Monson,October 2014
Continuing Revelation,President Henry B. Eyring,October 2014
Sustaining the Prophets,Elder Russell M. Nelson,October 2014
Live according to the Words of the Prophets,Carol F. McConkie,October 2014
"Eternal Life—to Know Our Heavenly Father and His Son, Jesus Christ",Elder Robert D. Hales,October 2014
The Sacrament and the Atonement,Elder James J. Hamula,October 2014
Ponder the Path of Thy Feet,President Thomas S. Monson,October 2014
Stay in the Boat and Hold On!,Elder M. Russell Ballard,October 2014
Make the Exercise of Faith Your First Priority,Elder Richard G. Scott,October 2014
The Lord Has a Plan for Us!,Elder Carlos A. Godoy,October 2014
The Book,Elder Allan F. Packer,October 2014
Our Personal Ministries,Elder Hugo E. Martinez,October 2014
Trifle Not with Sacred Things,Elder Larry S. Kacher,October 2014
Come and See,Elder David A. Bednar,October 2014
Until We Meet Again,President Thomas S. Monson,October 2014
Prepared in a Manner That Never Had Been Known,Linda K. Burton,October 2014
Covenant Daughters of God,Jean A. Stevens,October 2014
Sharing Your Light,Neill F. Marriott,October 2014
Living the Gospel Joyful,y President Dieter F. Uchtdorf,October 2014
Filling Our Homes with Light and Truth,Cheryl A. Esplin,April 2015
The Family Is of God,Carole M. Stephens,April 2015
Defenders of the Family Proclamation,y Bonnie L. Oscarson,April 2015
The Comforter,President Henry B. Eyring,April 2015
“Is Not This the Fast That I Have Chosen?”,President Henry B. Eyring,April 2015
The Plan of Happiness,President Boyd K. Packer,April 2015
We’ll Ascend Together,Linda K. Burton,April 2015
The Parable of the Sower,Elder Dallin H. Oaks,April 2015
Choose to Believe,Elder L. Whitney Clayton,April 2015
Why Marriage and Family Matter—Everywhere in the World,Elder L. Tom Perry,April 2015
The Sustaining of Church Officers,sented by President Dieter F. Uchtdorf,April 2015
"Church Auditing Department Report, 2014",sented by Kevin R. Jergensen,April 2015
"Statistical Report, 2014",sented by Brook P. Hales,April 2015
Therefore They Hushed Their Fears,Elder David A. Bednar,April 2015
"Why Marriage, Why Family",Elder D. Todd Christofferson,April 2015
The Music of the Gospel,y Elder Wilford W. Andersen,April 2015
Latter-day Saints Keep on Trying,Elder Dale G. Renlund,April 2015
Truly Good and without Guile,Elder Michael T. Ringwood,April 2015
The Lord Is My Light,Elder Quentin L. Cook,April 2015
The Greatest Generation of Young Adults,Elder M. Russell Ballard,April 2015
"Yes, We Can and Will Win!",Elder Ulisses Soares,April 2015
Fatherhood—Our Eternal Destiny,Larry M. Gibson,April 2015
On Being Genuine,President Dieter F. Uchtdorf,April 2015
Priesthood and Personal Prayer,President Henry B. Eyring,April 2015
The Priesthood—a Sacred Gift,President Thomas S. Monson,April 2015
Blessings of the Temple,President Thomas S. Monson,April 2015
Returning to Faith,Rosemary M. Wixom,April 2015
Seeking the Lord,Elder José A. Teixeira,April 2015
Is It Still Wonderful to You?,Bishop Gérald Caussé,April 2015
Waiting for the Prodigal,Elder Brent H. Nielson,April 2015
"Where Justice, Love, and Mercy Meet",y Elder Jeffrey R. Holland,April 2015
The Gift of Grace,President Dieter F. Uchtdorf,April 2015
"Preserving Agency, Protecting Religious Freedom",Elder Robert D. Hales,April 2015
Stay by the Tree,Elder Kevin W. Pearson,April 2015
The Eternal Perspective of the Gospel,Elder Rafael E. Pino,April 2015
Thy Kingdom Come,Elder Neil L. Andersen,April 2015
If You Will Be Responsible,Elder Jorge F. Zeballos,April 2015
"Be Fruitful, Multiply, and Subdue the Earth",Elder Joseph W. Sitati,April 2015
The Sabbath Is a Delight,Elder Russell M. Nelson,April 2015
Discovering the Divinity Within,Rosemary M. Wixom,October 2015
Worthy of Our Promised Blessings,Linda S. Reeves,October 2015
Here to Serve a Righteous Cause,Carol F. McConkie,October 2015
A Summer with Great-Aunt Rose,President Dieter F. Uchtdorf,October 2015
It Works Wonderfully!,President Dieter F. Uchtdorf,October 2015
God Is at the Helm,Elder M. Russell Ballard,October 2015
The Joy of Living a Christ-Centered Life,Elder Richard J. Maynes,October 2015
Yielding Our Hearts to God,Neill F. Marriott,October 2015
What Lack I Yet?,Elder Larry R. Lawrence,October 2015
The Pleasing Word of God,Elder Francisco J. Viñas,October 2015
Shipshape and Bristol Fashion: Be Temple Worthy—in Good Times and Bad Times,Elder Quentin L. Cook,October 2015
The Sustaining of Church Officers,sented by President Henry B. Eyring,October 2015
Meeting the Challenges of Today’s World,Elder Robert D. Hales,October 2015
Behold Thy Mother,Elder Jeffrey R. Holland,October 2015
It’s Never Too Early and It’s Never Too Late,Elder Bradley D. Foster,October 2015
Tested and Tempted—but Helped,Elder Hugo Montoya,October 2015
Choose the Light,Elder Vern P. Stanfill,October 2015
Turn to Him and Answers Will Come,Elder James B. Martino,October 2015
Strengthened by the Atonement of Jesus Christ,Elder Dallin H. Oaks,October 2015
"Faith Is Not by Chance, but by Choice",Elder Neil L. Andersen,October 2015
Your Next Step,Elder Randall K. Bennett,October 2015
"Be Not Afraid, Only Believe",President Dieter F. Uchtdorf,October 2015
You Are Not Alone in the Work,President Henry B. Eyring,October 2015
Keep the Commandments,President Thomas S. Monson,October 2015
Be an Example and a Light,President Thomas S. Monson,October 2015
I Stand All Amazed,Elder Ronald A. Rasband,October 2015
Plain and Precious Truths,Elder Gary E. Stevenson,October 2015
Through God’s Eyes,Elder Dale G. Renlund,October 2015
A Plea to My Sisters,President Russell M. Nelson,October 2015
Let the Clarion Trumpet Sound,Elder Gregory A. Schwitzer,October 2015
That They Do Always Remember Him,y Elder Claudio R. M. Costa,October 2015
The Holy Ghost as Your Companion,President Henry B. Eyring,October 2015
Why the Church,Elder D. Todd Christofferson,October 2015
My Heart Pondereth Them Continually,Devin G. Durrant,October 2015
Blessed and Happy Are Those Who Keep the Commandments of God,Elder Von G. Keetch,October 2015
"“If Ye Love Me, Keep My Commandments”",y Carole M. Stephens,October 2015
Remembering in Whom We Have Trusted,Elder Allen D. Haynie,October 2015
Eyes to See and Ears to Hear,y Elder Kim B. Clark,October 2015
Hold on Thy Way,Elder Koichi Aoyagi,October 2015
“Chosen to Bear Testimony of My Name”,Elder David A. Bednar,October 2015
He Asks Us to Be His Hands,Cheryl A. Esplin,April 2016
What Shall We Do?,Neill F. Marriott,April 2016
“I Was a Stranger”,Linda K. Burton,April 2016
Trust in That Spirit Which Leadeth to Do Good,President Henry B. Eyring,April 2016
Where Two or Three Are Gathered,President Henry B. Eyring,April 2016
A Child’s Guiding Gift,Mary R. Durham,April 2016
I Am a Child of God,Elder Donald L. Hallstrom,April 2016
Where Are the Keys and Authority of the Priesthood?,Elder Gary E. Stevenson,April 2016
The Healing Ointment of Forgiveness,Elder Kevin R. Duncan,April 2016
Be Thou Humble,Elder Steven E. Snow,April 2016
“That I Might Draw All Men unto Me”,Elder Dale G. Renlund,April 2016
The Sustaining of Church Officers,sented by President Dieter F. Uchtdorf,April 2016
"Church Auditing Department Report, 2015",sented by Kevin R. Jergensen,April 2016
"Statistical Report, 2015",sented by Brook P. Hales,April 2016
Standing with the Leaders of the Church,Elder Ronald A. Rasband,April 2016
"“Whoso Receiveth Them, Receiveth Me”",Elder Neil L. Andersen,April 2016
To the Rescue: We Can Do It,Elder Mervyn B. Arnold,April 2016
The Sacred Place of Restoration,Elder Jairo Mazzagardi,April 2016
Always Retain a Remission of Your Sins,Elder David A. Bednar,April 2016
Family Councils,Elder M. Russell Ballard,April 2016
The Price of Priesthood Power,President Russell M. Nelson,April 2016
The Greatest Leaders Are the Greatest Followers,Stephen W. Owen,April 2016
In Praise of Those Who Save,President Dieter F. Uchtdorf,April 2016
Eternal Families,President Henry B. Eyring,April 2016
A Sacred Trust,President Thomas S. Monson,April 2016
Choices,President Thomas S. Monson,April 2016
Do I Believe?,Bonnie L. Oscarson,April 2016
A Pattern for Peace,Bishop W. Christopher Waddell,April 2016
Fathers,Elder D. Todd Christofferson,April 2016
See Yourself in the Temple,Elder Quentin L. Cook,April 2016
He Will Place You on His Shoulders and Carry You Home,President Dieter F. Uchtdorf,April 2016
The Holy Ghost,Elder Robert D. Hales,April 2016
Always Remember Him,Elder Gerrit W. Gong,April 2016
Refuge from the Storm,y Elder Patrick Kearon,April 2016
Opposition in All Things,Elder Dallin H. Oaks,April 2016
The Power of Godliness,Elder Kent F. Richards,April 2016
And There Shall Be No More Death,Elder Paul V. Johnson,April 2016
Tomorrow the Lord Will Do Wonders among You,Elder Jeffrey R. Holland,April 2016
I Will Bring the Light of the Gospel into My Home,Jean B. Bingham,October 2016
The Master Healer,Carole M. Stephens,October 2016
"Rise Up in Strength, Sisters in Zion",Bonnie L. Oscarson,October 2016
"Fourth Floor, Last Door",President Dieter F. Uchtdorf,October 2016
O How Great the Plan of Our God!,President Dieter F. Uchtdorf,October 2016
"“Come, Follow Me” by Practicing Christian Love and Service",Elder Robert D. Hales,October 2016
The Soul’s Sincere Desire,Carol F. McConkie,October 2016
“A Choice Seer Will I Raise Up”,Elder Craig C. Christensen,October 2016
The Lord Jesus Christ Teaches Us to Pray,Elder Juan A. Uceda,October 2016
Am I Good Enough? Will I Make It?,Elder J. Devn Cornish,October 2016
A Witness of God,Elder Neil L. Andersen,October 2016
The Sustaining of Church Officers,sented by President Henry B. Eyring,October 2016
Valiant in the Testimony of Jesus,Elder Quentin L. Cook,October 2016
"Look to the Book, Look to the Lord",Elder Gary E. Stevenson,October 2016
“Abide in My Love”,Elder D. Todd Christofferson,October 2016
For Our Spiritual Development and Learning,Elder W. Mark Bassett,October 2016
Be Ambitious for Christ,Elder Kazuhiko Yamashita,October 2016
Sharing the Restored Gospel,Elder Dallin H. Oaks,October 2016
Emissaries to the Church,Elder Jeffrey R. Holland,October 2016
There Is Power in the Book,Elder LeGrand R. Curtis Jr.,October 2016
Learn from Alma and Amulek,President Dieter F. Uchtdorf,October 2016
That He May Become Strong Also,President Henry B. Eyring,October 2016
Principles and Promises,President Thomas S. Monson,October 2016
The Perfect Path to Happiness,President Thomas S. Monson,October 2016
Joy and Spiritual Survival,President Russell M. Nelson,October 2016
The Sacrament Can Help Us Become Holy,Elder Peter F. Meurs,October 2016
The Great Plan of Redemption,Linda S. Reeves,October 2016
To Whom Shall We Go?,Elder M. Russell Ballard,October 2016
The Blessings of Worship,Bishop Dean M. Davies,October 2016
The Righteous Judge,Elder Lynn G. Robbins,October 2016
Gratitude on the Sabbath Day,President Henry B. Eyring,October 2016
“If Ye Had Known Me”,Elder David A. Bednar,October 2016
The Doctrine of Christ,Brian K. Ashton,October 2016
Serve,Elder Carl B. Cook,October 2016
Lest Thou Forget,Elder Ronald A. Rasband,October 2016
God Shall Wipe Away All Tears,Elder Evan A. Schmutz,October 2016
No Greater Joy Than to Know That They Know,Elder K. Brett Nattress,October 2016
Repentance: A Joyful Choice,Elder Dale G. Renlund,October 2016
Trust in the Lord and Lean Not,y Bonnie H. Cordon,April 2017
The Beauty of Holiness,Carol F. McConkie,April 2017
Certain Women,Linda K. Burton,April 2017
“My Peace I Leave with You”,President Henry B. Eyring,April 2017
Gathering the Family of God,President Henry B. Eyring,April 2017
His Daily Guiding Hand,M. Joseph Brough,April 2017
Our Father’s Glorious Plan,Elder Weatherford T. Clayton,April 2017
Our Good Shepherd,Elder Dale G. Renlund,April 2017
Confide in God Unwaveringly,Elder Ulisses Soares,April 2017
Brighter and Brighter until the Perfect Day,Elder Mark A. Bragg,April 2017
Drawing the Power of Jesus Christ into Our Lives,y President Russell M. Nelson,April 2017
The Sustaining of Church Officers,sented by President Dieter F. Uchtdorf,April 2017
"Church Auditing Department Report, 2016",sented by Kevin R. Jergensen,April 2017
"Statistical Report, 2016",sented by Brook P. Hales,April 2017
Becoming a Disciple of Our Lord Jesus Christ,y Elder Robert D. Hales,April 2017
Songs Sung and Unsung,y Elder Jeffrey R. Holland,April 2017
Stand Up Inside and Be All In,Elder Gary B. Sabin,April 2017
The Language of the Gospel,Elder Valeri V. Cordón,April 2017
Overcoming the World,Elder Neil L. Andersen,April 2017
Return and Receive,Elder M. Russell Ballard,April 2017
"Kindness, Charity, and Love",President Thomas S. Monson,April 2017
Called to the Work,Elder David A. Bednar,April 2017
Prepare the Way,Bishop Gérald Caussé,April 2017
The Greatest among You,President Dieter F. Uchtdorf,April 2017
“Walk with Me”,President Henry B. Eyring,April 2017
The Power of the Book of Mormon,President Thomas S. Monson,April 2017
A Sin-Resistant Generation,Joy D. Jones,April 2017
"Don’t Look Around, Look Up!",Elder Yoon Hwan Choi,April 2017
Let the Holy Spirit Guide,Elder Ronald A. Rasband,April 2017
"Whatsoever He Saith unto You, Do It",y Elder L. Whitney Clayton,April 2017
The Godhead and the Plan of Salvation,y Elder Dallin H. Oaks,April 2017
Perfect Love Casteth Out Fear,President Dieter F. Uchtdorf,April 2017
The Voice of Warning,Elder D. Todd Christofferson,April 2017
To the Friends and Investigators of the Church,Elder Joaquin E. Costa,April 2017
Then Jesus Beholding Him Loved Him,Elder S. Mark Palmer,April 2017
How Does the Holy Ghost Help You?,Elder Gary E. Stevenson,April 2017
And This Is Life Eternal,Elder C. Scott Grow,April 2017
That Our Light May Be a Standard for the Nations,Elder Benjamín De Hoyos,April 2017
Foundations of Faith,Elder Quentin L. Cook,April 2017
Turn On Your Light,Sharon Eubank,October 2017
Abiding in God and Repairing the Breach,Neill F. Marriott,October 2017
Value beyond Measure,Joy D. Jones,October 2017
Three Sisters,President Dieter F. Uchtdorf,October 2017
A Yearning for Home,y President Dieter F. Uchtdorf,October 2017
The Needs before Us,Bonnie L. Oscarson,October 2017
The Plan and the Proclamation,Elder Dallin H. Oaks,October 2017
“I Have a Work for Thee”,Elder John C. Pingree Jr.,October 2017
The Living Bread Which Came Down from Heaven,Elder D. Todd Christofferson,October 2017
Be Ye Therefore Perfect—Eventually,Elder Jeffrey R. Holland,October 2017
The Sustaining of Church Officers,sented by President Henry B. Eyring,October 2017
Spiritual Eclipse,y Elder Gary E. Stevenson,October 2017
Repentance Is Always Positive,Stephen W. Owen,October 2017
The Eternal Everyday,Elder Quentin L. Cook,October 2017
By Divine Design,Elder Ronald A. Rasband,October 2017
The Heart of the Widow,Elder O. Vincent Haleck,October 2017
The Book of Mormon: What Would Your Life Be Like without It?,President Russell M. Nelson,October 2017
The Priesthood and the Savior’s Atoning Power,Elder Dale G. Renlund,October 2017
The Truth of All Things,Elder David F. Evans,October 2017
Earning the Trust of the Lord and Your Family,Elder Richard J. Maynes,October 2017
Bearers of Heavenly Light,President Dieter F. Uchtdorf,October 2017
The Lord Leads His Church,President Henry B. Eyring,October 2017
That Your Joy Might Be Full,Jean B. Bingham,October 2017
Has the Day of Miracles Ceased?,Elder Donald L. Hallstrom,October 2017
Exceeding Great and Precious Promises,Elder David A. Bednar,October 2017
Turn to the Lord,Bishop W. Christopher Waddell,October 2017
"Lord, Wilt Thou Cause That My Eyes May Be Opened",Elder W. Craig Zwick,October 2017
Fear Not to Do Good,President Henry B. Eyring,October 2017
The Trek Continues!,Elder M. Russell Ballard,October 2017
God’s Compelling Witness: The Book of Mormon,Tad R. Callister,October 2017
"Apart, but Still One",Elder Joni L. Koch,October 2017
Do We Trust Him? Hard Is Good,Elder Stanley G. Ellis,October 2017
Essential Truths—Our Need to Act,Elder Adilson de Paula Parrella,October 2017
Seek Ye Out of the Best Books,Elder Ian S. Ardern,October 2017
Love One Another as He Has Loved Us,Elder Jose L. Alonso,October 2017
The Voice of the Lord,Elder Neil L. Andersen,October 2017
Solemn Assembly,sented by President Henry B. Eyring,April 2018
Precious Gifts from God,President M. Russell Ballard,April 2018
Am I a Child of God?,Elder Brian K. Taylor,April 2018
"Even as Christ Forgives You, So Also Do Ye",Elder Larry J. Echo Hawk,April 2018
The Heart of a Prophet,Elder Gary E. Stevenson,April 2018
Until Seventy Times Seven,Elder Lynn G. Robbins,April 2018
The Prophet of God,Elder Neil L. Andersen,April 2018
The Sustaining of Church Officers,sented by President Dallin H. Oaks,April 2018
"Church Auditing Department Report, 2017",sented by Kevin R. Jergensen,April 2018
Meek and Lowly of Heart,Elder David A. Bednar,April 2018
One More Day,Elder Taylor G. Godoy,April 2018
Young Women in the Work,Bonnie L. Oscarson,April 2018
Saving Ordinances Will Bring Us Marvelous Light,Elder Taniela B. Wakolo,April 2018
Teaching in the Home—a Joyful and Sacred Responsibility,Devin G. Durrant,April 2018
Family History and Temple Work: Sealing and Healing,Elder Dale G. Renlund,April 2018
What Every Aaronic Priesthood Holder Needs to Understand,Douglas D. Holmes,April 2018
Introductory Remarks,President Russell M. Nelson,April 2018
The Elders Quorum,Elder D. Todd Christofferson,April 2018
Behold! A Royal Army,Elder Ronald A. Rasband,April 2018
Inspired Ministering,President Henry B. Eyring,April 2018
The Powers of the Priesthood,President Dallin H. Oaks,April 2018
Ministering with the Power and Authority of God,President Russell M. Nelson,April 2018
Take the Holy Spirit as Your Guide,Elder Larry Y. Wilson,April 2018
With One Accord,Reyna I. Aburto,April 2018
Pure Love: The True Sign of Every True Disciple of Jesus Christ,Elder Massimo De Feo,April 2018
"He That Shall Endure unto the End, the Same Shall Be Saved",Elder Claudio D. Zivic,April 2018
His Spirit to Be with You,President Henry B. Eyring,April 2018
Small and Simple Things,President Dallin H. Oaks,April 2018
"Revelation for the Church, Revelation for Our Lives",President Russell M. Nelson,April 2018
Christ the Lord Is Risen Today,Elder Gerrit W. Gong,April 2018
Prophets Speak by the Power of the Holy Spirit,Elder Ulisses Soares,April 2018
Ministering,President Russell M. Nelson,April 2018
“Be With and Strengthen Them”,Elder Jeffrey R. Holland,April 2018
Ministering as the Savior Does,Jean B. Bingham,April 2018
Behold the Man!,Elder Dieter F. Uchtdorf,April 2018
It Is All about People,Bishop Gérald Caussé,April 2018
Prepare to Meet God,Elder Quentin L. Cook,April 2018
Let Us All Press On,President Russell M. Nelson,April 2018
Opening Remarks,President Russell M. Nelson,October 2018
Deep and Lasting Conversion to Heavenly Father and the Lord Jesus Christ,Elder Quentin L. Cook,October 2018
Lift Up Your Head and Rejoice,M. Joseph Brough,October 2018
Laying the Foundation of a Great Work,Elder Steven R. Bangerter,October 2018
Be Not Troubled,y Elder Ronald A. Rasband,October 2018
Gather Together in One All Things in Christ,Elder David A. Bednar,October 2018
Truth and the Plan,y President Dallin H. Oaks,October 2018
The Sustaining of Church Officers,sented by President Henry B. Eyring,October 2018
Firm and Steadfast in the Faith of Christ,Elder D. Todd Christofferson,October 2018
"Come, Listen to a Prophet’s Voice",Bishop Dean M. Davies,October 2018
One in Christ,y Elder Ulisses Soares,October 2018
Our Campfire of Faith,y Elder Gerrit W. Gong,October 2018
All Must Take upon Them the Name Given of the Father,y Elder Paul B. Pieper,October 2018
"Believe, Love, Do",Elder Dieter F. Uchtdorf,October 2018
For Him,Joy D. Jones,October 2018
Divine Discontent,Michelle D. Craig,October 2018
The Joy of Unselfish Service,Cristina B. Franco,October 2018
Women and Gospel Learning in the Home,President Henry B. Eyring,October 2018
Parents and Children,President Dallin H. Oaks,October 2018
Sisters’ Participation in the Gathering of Israel,President Russell M. Nelson,October 2018
The Vision of the Redemption of the Dead,President M. Russell Ballard,October 2018
Becoming a Shepherd,Bonnie H. Cordon,October 2018
The Ministry of Reconciliation,Elder Jeffrey R. Holland,October 2018
The Role of the Book of Mormon in Conversion,Elder Shayne M. Bowen,October 2018
Wounded,Elder Neil L. Andersen,October 2018
The Correct Name of the Church,President Russell M. Nelson,October 2018
"Try, Try, Try",President Henry B. Eyring,October 2018
The Father,Brian K. Ashton,October 2018
Taking upon Ourselves the Name of Jesus Christ,Elder Robert C. Gay,October 2018
Wilt Thou Be Made Whole?,Elder Matthew L. Carpenter,October 2018
Choose You This Day,Elder Dale G. Renlund,October 2018
Now Is the Time,Elder Jack N. Gerard,October 2018
Shepherding Souls,Elder Gary E. Stevenson,October 2018
Becoming Exemplary Latter-day Saints,President Russell M. Nelson,October 2018
How Can I Understand?,Elder Ulisses Soares,April 2019
Careful versus Casual,Becky Craven,April 2019
Answers to Prayer,Elder Brook P. Hales,April 2019
Missionary Work: Sharing What Is in Your Heart,Elder Dieter F. Uchtdorf,April 2019
Just as He Did,Bishop W. Christopher Waddell,April 2019
A Home Where the Spirit of the Lord Dwells,President Henry B. Eyring,April 2019
The Sustaining of Church Officers,sented by President Dallin H. Oaks,April 2019
"Church Auditing Department Report, 2018",sented by Kevin R. Jergensen,April 2019
"The True, Pure, and Simple Gospel of Jesus Christ",President M. Russell Ballard,April 2019
Seeking Knowledge by the Spirit,Elder Mathias Held,April 2019
The Eye of Faith,Elder Neil L. Andersen,April 2019
Feasting upon the Words of Christ,Elder Takashi Wada,April 2019
Hearing His Voice,Elder David P. Homer,April 2019
Behold the Lamb of God,Elder Jeffrey R. Holland,April 2019
Your Priesthood Playbook,Elder Gary E. Stevenson,April 2019
The Quorum: A Place of Belonging,Elder Carl B. Cook,April 2019
Look unto Jesus Christ,Elder Kim B. Clark,April 2019
The Power of Sustaining Faith,President Henry B. Eyring,April 2019
Where Will This Lead?,President Dallin H. Oaks,April 2019
We Can Do Better and Be Better,President Russell M. Nelson,April 2019
Abound with Blessings,Elder Dale G. Renlund,April 2019
Christ: The Light That Shines in Darkness,Sharon Eubank,April 2019
Great Love for Our Father’s Children,Elder Quentin L. Cook,April 2019
Preparing for the Lord’s Return,Elder D. Todd Christofferson,April 2019
The Atonement of Jesus Christ,Tad R. Callister,April 2019
"“Come, Follow Me”",President Russell M. Nelson,April 2019
Cleansed by Repentance,President Dallin H. Oaks,April 2019
Exercising Our Spiritual Muscles,Elder Juan Pablo Villar,April 2019
"Good Shepherd, Lamb of God",Elder Gerrit W. Gong,April 2019
Prepared to Obtain Every Needful Thing,Elder David A. Bednar,April 2019
The Immediate Goodness of God,Elder Kyle S. McKay,April 2019
Build a Fortress of Spirituality and Protection,Elder Ronald A. Rasband,April 2019
Closing Remarks,President Russell M. Nelson,April 2019
"The Message, the Meaning, and the Multitude",Elder Jeffrey R. Holland,October 2019
True Disciples of the Savior,Elder Terence M. Vinson,October 2019
"Be Faithful, Not Faithless",Stephen W. Owen,October 2019
The Joy of the Saints,Elder D. Todd Christofferson,October 2019
Spiritual Capacity,Michelle Craig,October 2019
Unwavering Commitment to Jesus Christ,Elder Dale G. Renlund,October 2019
